id,element,attributeNum,operationNum,instanceVarNum,externalOperNum,parameterNum,weightedOperNum,numberOfDerivedClasses,numberOfChildren,numberOfClassesInherited,depthInheritanceTree,numberOfDerivingClasses,isTopLevelClass,numberOfClassesInheritedFrom,numberOfInheritanceRelationships,numberOfAssociatedClasses,numberOfAssociatingClasses,numberOfAssociationRelationships,numberOfUsedClasses,numberOfUsingClasses,numberOfUsageRelationships,couplingBetweenObjects
1,Data Service Configuration Form,4,1,4,1,0,0.3,0,0,0,0,0,true,0,0,0,4,4,0,0,0,4
2,Product Configuration,6,1,6,1,0,0.3,0,0,0,0,0,true,0,0,4,0,4,0,0,0,4
3,Sensor Data Export File,4,1,4,1,0,0.3,0,0,0,0,0,true,0,0,0,0,0,0,0,0,0
4,Sensor Product Configuration Form,6,1,6,1,0,0.3,0,0,0,0,0,true,0,0,0,0,0,0,0,0,0
5,User Account,5,1,5,1,0,0.3,0,0,0,0,0,true,0,0,0,0,0,0,0,0,0
